"id","url","stime","title","nocommentsgesamt","nocommentsx"
"98-278-t3_7l6cwh","https://www.reddit.com/r/de/comments/7l6cwh/liebe_autofahrer_könntet_ihr_auf_der_autobahn/","2017-12-21 02:16:00","Liebe Autofahrer, könntet Ihr auf der Autobahn bitte auf der rechten Spur fahren und die mittlere und linke Spur nur zum Überholen benutzen?","276","222"
"98-84-t3_7lgoj8","https://i.redd.it/v6qjzd89cg501.jpg","2017-12-22 10:35:54","Danke nein","243","214"
"98-3-t3_7lks1c","https://i.redd.it/xmxzthwdvj501.png","2017-12-22 22:30:46","Falls nur /r/de wählen dürfte, dann würde die CDU/CSU nur sehr knapp über die 5%-Hürde kommen, während die 2 am wenigsten im Bundestag vertretenen Parteien, die Hälfte der Stimmen hätten","230","79"
"98-202-t3_7l966q","https://i.redd.it/vpars5q2s9501.jpg","2017-12-21 12:32:23","Selten aber sehr stark!","226","174"
"98-133-t3_7ld3c6","https://www.reddit.com/r/de/comments/7ld3c6/meinen_freunden_fehlt_jegliches_feingefühl_und_es/","2017-12-21 22:42:46","Meinen Freunden fehlt jegliches Feingefühl und es ist mir langsam echt peinlich","154","81"
"98-117-t3_7lf1wk","https://www.n-tv.de/wirtschaft/Die-USA-werden-zur-Bananenrepublik-article20197650.html","2017-12-22 04:22:00","Trump bereichert sich selbst: Die USA werden zur Bananenrepublik","152","134"
"98-275-t3_7l7qt1","https://i.imgur.com/iqGkmWf.jpg","2017-12-21 06:44:48","Hmmm.","140","124"
"98-264-t3_7l82cr","https://www.reddit.com/r/de/comments/7l82cr/kw51donnerstag_was_geschieht_bei_euch_in_der/","2017-12-21 07:58:45","KW51/Donnerstag: Was geschieht bei euch in der Region, wovon wir nichts mitbekommen?","139","93"
"98-179-t3_7la5vt","https://derstandard.at/2000070834253/Fehler-bei-IP-Adressen-Viele-Briten-faelschlich-wegen-Kinderpornos-verhaftet?ref=article","2017-12-21 15:34:00","Fehler bei IP-Adressen: Viele Briten fälschlich wegen Kinderpornos verhaftet","138","95"
"98-108-t3_7lfuzm","https://www.worldcoinindex.com/trending/overview","2017-12-22 07:10:16","Starke Korrektur fast aller Kryptowährungen um durchschnittlich 20%","134","106"
"98-189-t3_7l9p4e","http://www.sueddeutsche.de/digital/akku-leistung-warum-apple-alte-iphones-verlangsamt-1.3801319","2017-12-21 14:14:39","Alte iPhones werden wohl absichtlich langsamer. Das ist ein Feature, kein Bug, sagt Apple.","128","55"
"98-48-t3_7li9j3","http://www.spiegel.de/lebenundlernen/schule/berlin-wedding-mitschueler-bedrohen-juedischen-gymnasiasten-a-1184733.html","2017-12-22 15:56:39","Antisemitismus in Berlin: Mitschüler bedrohen jüdischen Gymnasiasten - SPIEGEL ONLINE","127","85"
"98-240-t3_7l8jo3","https://www.reddit.com/r/de/comments/7l8jo3/antifantastisch_schwarz_roteflora_gold/","2017-12-21 10:04:42","Antifantastisch: Schwarz, Roteflora, Gold","122","100"
"98-59-t3_7lhn48","https://www.reddit.com/r/de/comments/7lhn48/kleiner_dhl_rant_von_der_anderen_seite/","2017-12-22 14:09:50","Kleiner DHL rant von der anderen Seite","122","98"
"98-73-t3_7lh5sf","https://i.redd.it/zebq1g23xg501.jpg","2017-12-22 12:33:16","Aaahhh... Zeit für den gelben Schein","120","96"
"98-103-t3_7lg5dq","http://www.spiegel.de/lebenundlernen/schule/rewe-weihnachtswette-zweitklaessler-aus-hannover-singen-weihnachtslied-a-1184166.html","2017-12-22 08:20:04","Werbeaktion im Unterricht: Zweitklässler singen während der Schulzeit bei Rewe","111","104"
"98-88-t3_7lglx1","https://www.reddit.com/r/de/comments/7lglx1/ich_habe_mitbekommen_wie_sich_die_hölle_anhört/","2017-12-22 10:16:58","Ich habe mitbekommen wie sich die Hölle anhört","109","99"
"98-194-t3_7l9kpd","https://www.reddit.com/r/de/comments/7l9kpd/eine_matraze_zu_entsorgen_kostet_in_meiner_stadt/","2017-12-21 13:52:54","Eine Matraze zu entsorgen kostet in meiner Stadt 24€ - holy shit?!?","104","84"
"98-192-t3_7l9l4s","https://i.redd.it/8fg3clov6a501.jpg","2017-12-21 13:54:57","Vom Worten ermordet","104","85"
"98-268-t3_7l7yx3","https://www.welt.de/wirtschaft/article171748044/Berufsausbildung-Fluechtlinge-passen-nicht-ins-deutsche-System.html","2017-12-21 07:35:25","Berufsausbildung: Flüchtlinge passen nicht ins deutsche System","99","69"
"98-247-t3_7l8edr","https://i.redd.it/k28w4rbpu8501.png","2017-12-21 09:25:26","Ein neues Wort wurde erschaffen","96","79"
"98-64-t3_7lhhbm","http://www.strawpoll.me/14675169","2017-12-22 13:40:10","Umfrage für /r/de bezüglich des Wahlverhaltens. Würde mich mal interessieren, wie das Subreddit politisch so tickt.","95","88"
"98-45-t3_7libpu","https://www.reddit.com/r/de/comments/7libpu/die_dkms_hat_bei_mir_angerufen_teil_2/","2017-12-22 16:06:30","Die DKMS hat bei mir angerufen... [Teil 2]","92","74"
"98-58-t3_7lhp16","https://www.reddit.com/r/de/comments/7lhp16/ein_nachtbuserlebnis_oder_warum_der_türsteher/","2017-12-22 14:19:43","""Ein Nachtbuserlebnis"" oder ""warum der Türsteher dich nicht reinlässt""","86","70"
"98-10-t3_7lkfaf","https://www.stern.de/panorama/stern-crime/berliner-u-bahn-treter-in-jva-von-mithaeftlingen-schwer-verpruegelt-7797790.html","2017-12-22 21:31:13","Berliner U-Bahn-Treter in JVA von Mithäftlingen schwer verprügelt","85","32"
"98-71-t3_7lh7q6","http://www.spiegel.de/politik/deutschland/andrea-nahles-draengt-union-zu-steuererhoehungen-a-1184659.html","2017-12-22 12:44:33","Vor Sondierungsgesprächen mit der Union: Nahles drängt auf höhere Steuern für Reiche.","80","75"
"98-35-t3_7lijz5","https://i.redd.it/a3ihpiilah501.jpg","2017-12-22 16:42:04","sachen gibts ...","80","51"
"98-92-t3_7lgho5","https://imgur.com/AHHvuzW","2017-12-22 09:47:39","Es ist wieder Zeit, meine Jungs.","74","70"
"98-204-t3_7l941m","https://i.imgur.com/kI08FII.png","2017-12-21 12:19:47","Ähhh, beides","74","47"
"98-52-t3_7lhwn9","https://www.reddit.com/r/de/comments/7lhwn9/ich_bin_seit_2_monaten_krank_bitte_helft_mir_doch/","2017-12-22 14:57:55","Ich bin seit 2 Monaten krank. Bitte helft mir doch jemand.","73","72"
"98-182-t3_7la0v2","https://www.reddit.com/r/de/comments/7la0v2/kündigung_wegen_depression_rechtmäßig/","2017-12-21 15:11:13","Kündigung wegen Depression rechtmäßig?","70","49"
"98-109-t3_7lft1k","http://www.faz.net/aktuell/gesellschaft/menschen/star-wars-mark-hamill-ueber-seine-rolle-als-luke-skywalker-15331326.html","2017-12-22 06:58:00","Interview mit Mark Hamill: „Dieser Beruf bricht dir das Herz“","69","59"
"98-258-t3_7l85w4","https://imgur.com/w4q6TEk","2017-12-21 08:22:36","Jetzt wollen's die Identitären genau wissen!","68","54"
"98-234-t3_7l8lf7","https://i.imgur.com/x4CllRN.jpg","2017-12-21 10:17:01","MaiMai Überlast","66","49"
"98-20-t3_7ljj93","http://www.br.de/nachrichten/feuerwehr-ausgebremst-polizisten-angefahren-und-ehefrau-verpruegelt100~amp.html","2017-12-22 19:09:15","Berliner überholt Feuerwehrfahrzeuge in der Rettungsgasse, fährt einen Polizisten an und schlägt seine Ehefrau.","65","35"
"98-176-t3_7laa2z","https://www.mopo.de/hamburg/lamborghini-einkassiert-so-bepoebelte-tim-wiese-die-polizei-29329228","2017-12-21 15:52:18","„Hättet ihr in der Schule richtig aufgepasst, dann könntet ihr euch jetzt auch so einen Wagen leisten.“ – Tim Wieses Lamborghini wurde gestern in Hamburg stillgelegt.","64","45"
"98-137-t3_7lcmpi","https://www.reddit.com/r/de/comments/7lcmpi/was_denken_die_deutsche_über_homosexualität_und/","2017-12-21 21:32:13","Was denken die Deutsche über Homosexualität und Ehe für alle?","63","60"
"98-218-t3_7l8ti2","https://www.reddit.com/r/de/comments/7l8ti2/wie_man_einen_therapieplatz_findet_oc/","2017-12-21 11:12:55","Wie man einen Therapieplatz findet (OC)","63","54"
"98-86-t3_7lgnjb","https://www.reddit.com/r/de/comments/7lgnjb/seid_ihr_in_weihnachtsstimmung/","2017-12-22 10:28:14","Seid ihr in Weihnachtsstimmung?","62","57"
"98-99-t3_7lgca4","https://www.heise.de/newsticker/meldung/Immer-schoen-konform-100-Jahre-DIN-Norm-3926511.html","2017-12-22 09:10:53","Immer schön konform: 100 Jahre DIN-Norm","62","56"
"98-220-t3_7l8rbn","https://www.reddit.com/r/de/comments/7l8rbn/was_macht_ihr_wenn_ihr_von_einem_gefühl_der/","2017-12-21 10:58:47","Was macht ihr wenn ihr von einem Gefühl der Einsamkeit überwältigt werdet?","62","58"
"98-17-t3_7ljp4o","https://twitter.com/mistermacheath/status/943912082885537792","2017-12-22 19:35:00","Heimat ist, wenn mein Vater 5km Umweg fährt, um die Benzinpreise von zwei Tankstellen zu vergleichen und danach nicht zu tanken.","61","39"
"98-186-t3_7l9udf","https://kurier.at/politik/ausland/norwegen-entkriminalisiert-gebrauch-von-drogen/302.790.432","2017-12-21 14:41:05","Norwegen entkriminali­siert Gebrauch von Drogen","61","47"
"98-259-t3_7l84u4","https://derstandard.at/2000070800518/US-Regierung-belegt-Bombardier-Jets-mit-300-Prozent-Strafzoellen","2017-12-21 08:15:26","US-Regierung belegt Bombardier-Jets mit 300 Prozent Strafzoll","59","55"
"98-107-t3_7lfxgc","http://www.rp-online.de/nrw/panorama/knoellchenstreit-in-dueren-29-jaehriger-zu-vier-jahren-haft-verurteilt-aid-1.7281552","2017-12-22 07:25:47","Prügelattacke wegen Knöllchens - Haftstrafe für 29-Jährigen","59","54"
"98-260-t3_7l84t9","http://www.spiegel.de/panorama/gesellschaft/obdachlosigkeit-in-deutschland-wir-haben-ein-riesenproblem-a-1184255.html","2017-12-21 08:15:17","Obdachlosigkeit in Deutschland: ""Wir haben ein Riesenproblem""","58","48"
"98-125-t3_7ldp5h","https://www.youtube.com/watch?v=MYMXM6w571w","2017-12-22 00:20:09","Komm in die Gruppe ! Brudi ! Bei mir läuft nicht, bei mir rennt !","56","38"
"98-156-t3_7lb9t5","https://www.reddit.com/r/de/comments/7lb9t5/bereichsleiter_softwareentwicklung_weiß_nicht/","2017-12-21 18:16:20","Bereichsleiter Softwareentwicklung weiß nicht, dass man einen neuen Tab mit rechter Maustaste öffnen kann - und das in renommierter IT-Sicherheitsfirma in Deutschland 🤦‍♂️🤦‍♂️🤦‍♂️","55","50"
"98-200-t3_7l99wa","https://netzpolitik.org/2017/de-maiziere-plant-flaechendeckende-gesichtserkennung-trotz-hoher-fehlerquoten-am-suedkreuz/","2017-12-21 12:53:58","De Maizière plant flächendeckende Gesichtserkennung trotz hoher Fehlerquoten am Südkreuz","55","50"
"98-221-t3_7l8rav","https://imgur.com/b5jbg6a","2017-12-21 10:58:35","Anweisungen befolgt. 94.5kg. Hausverbot bekommen. Was nun?","53","47"
"98-155-t3_7lbdt3","https://www.heise.de/newsticker/meldung/Urteil-gegen-Tagesschau-App-nun-rechtskraeftig-3926334.html","2017-12-21 18:32:31","Urteil gegen ""Tagesschau""-App nun rechtskräftig - Der Bundesgerichtshof lässt keine Revision des OLG-Urteils gegen die App der Tagesschau zu, in dem sie als zu presseähnlich bewertet wurde.","52","33"
"98-21-t3_7lj9q2","https://youtu.be/T8_nDwZtr00","2017-12-22 18:28:24","Wie man Strassen-Stalking durch Geheimdienste und Staatsschutz erkennt!","48","35"
"98-211-t3_7l8yr2","https://www.focus.de/politik/deutschland/alice-weidel-afd-fraktionschefin-erhebt-schwere-vorwuerfe-gegen-die-kirche_id_8036449.html","2017-12-21 11:47:47","Alice Weidel: AfD-Fraktionschefin erhebt schwere Vorwürfe gegen die Kirche","48","46"
"98-232-t3_7l8mfl","https://i.redd.it/nwa4eqy859501.png","2017-12-21 10:24:11","""San Zi scho mal in Züri xi?""","48","37"
"98-91-t3_7lgjfs","https://scontent.fdtm1-1.fna.fbcdn.net/v/t1.0-9/25551985_1771201889617235_7218095075020999512_n.jpg?oh=e4ec18c8528454829c6a6e9857910024&oe=5AD3280C","2017-12-22 10:00:26","Öffentliche Foto-Fahndung: Polizei sucht nach diesen G20-Chaoten von Hamburg","45","40"
"98-170-t3_7laflf","https://i.redd.it/bmarz98cva501.png","2017-12-21 16:15:07","Wenn Buzzwords mit Gier und Verzweiflung kombiniert werden...Zielgruppe: ""Investment Banker""","45","27"
"98-118-t3_7lezqf","https://www.reddit.com/r/de/comments/7lezqf/kulturfreitag_22_dec_2017/","2017-12-22 04:10:21","Kulturfreitag - 22 Dec, 2017","44","20"
"98-56-t3_7lhrr7","https://www.reddit.com/r/de/comments/7lhrr7/wie_habt_ihrs_so_mit_der_religion/","2017-12-22 14:33:38","Wie habt ihr's so mit der Religion?","42","39"
"98-226-t3_7l8pky","https://futurezone.at/netzpolitik/jeder-kollege-kann-meine-nacktbilder-auf-google-sehen/300.221.825","2017-12-21 10:46:10","“Jeder Kollege kann meine Nacktbilder auf Google sehen”","42","39"
"98-140-t3_7lcdu8","https://www.reddit.com/r/de/comments/7lcdu8/gab_es_schon_irgenwelche_abmahnungen_für_burning/","2017-12-21 20:57:24","Gab es schon irgenwelche Abmahnungen für Burning Series oder Kinox?","42","23"
"98-207-t3_7l92oy","http://www.zeit.de/wirtschaft/2017-12/buergerversicherung-cdu-spd-koalition-gesundheitssystem-gerechtigkeit-konflikt","2017-12-21 12:11:51","Bürgerversicherung: Auf die Topverdiener kommt es an","40","37"
"98-70-t3_7lh97w","https://www.reddit.com/r/de/comments/7lh97w/rücksicht_und_besinnlichkeit_im_supermarkt/","2017-12-22 12:53:07","Rücksicht und Besinnlichkeit im Supermarkt","37","34"
"98-160-t3_7lb2qs","https://www.reddit.com/r/de/comments/7lb2qs/könnt_ihr_mal_platz_machen_ihr_pissnelken/","2017-12-21 17:48:42","Könnt ihr mal Platz machen, ihr Pissnelken?","37","20"
"98-42-t3_7lifir","https://i.imgur.com/jceLfC4.jpg","2017-12-22 16:22:42","Zu früh für LKW-Witze? Nicht für Matthias Oomen (Bündnis 90/Die Grünen)","37","23"
"98-241-t3_7l8ioh","https://i.imgur.com/oi8EM4E.jpg","2017-12-21 09:57:37","Sternenhimmel in Kühtai gestern Abend [OC]","36","32"
"98-134-t3_7lcy2w","https://www.reddit.com/r/de/comments/7lcy2w/raclette_ein_euphemismus_für_resteverwertung/","2017-12-21 22:19:47","Raclette, ein Euphemismus für Resteverwertung","35","34"
"98-235-t3_7l8l9s","http://www.faz.net/aktuell/politik/inland/christian-lindner-jamaika-doch-wieder-vorstellbar-15352914.html","2017-12-21 10:15:50","Regierungsbildung: Lindner denkt wieder über Jamaika nach","35","33"
"98-190-t3_7l9nzh","https://www.reddit.com/r/de/comments/7l9nzh/hallo_leute_kleine_frage_ueber_strassennamen_in/","2017-12-21 14:08:56","Hallo Leute! Kleine frage ueber Strassennamen in Deutschland (und Oesterrich und auch in die Schweiz).","33","33"
"98-93-t3_7lghce","https://www.heise.de/newsticker/meldung/Handwerkspraesident-Fachkraeftemangel-hemmt-Wachstum-3926891.html","2017-12-22 09:45:23","Handwerkspräsident: Fachkräftemangel hemmt Wachstum","32","18"
"98-163-t3_7lav28","https://www.reddit.com/r/de/comments/7lav28/duschgedanken_ein_selbstfahrender_wagen_mit/","2017-12-21 17:17:56","Duschgedanken: Ein selbstfahrender Wagen mit Automatikgetriebe ist ein Autoautoauto.","32","22"
"98-1-t3_7lkw2m","https://www.reddit.com/r/de/comments/7lkw2m/das_schlimmste_filmtitel_in_deutchland/","2017-12-22 22:49:23","Das schlimmste Filmtitel in Deutchland?","31","10"
"98-139-t3_7lcj87","https://i.imgur.com/LWOf4J2.jpg","2017-12-21 21:18:25","Jeden Tag reiten wir auf unseren Einhörner weiter weg von Gottes Licht","31","19"
"98-237-t3_7l8k20","https://bazonline.ch/basel/stadt/verdacht-auf-illegale-organentnahme/story/21632645","2017-12-21 10:07:31","Verdacht auf illegale Organentnahme: Die Mutter eines verstorbenen 20-jährigen Deutschen erhebt Vorwürfe gegen das Unispital Basel. Sie hat den Verdacht, die Ärzte seien in einen organisierten Organhandel verstrickt.","31","22"
"98-41-t3_7lift3","https://i.imgur.com/28VRjSJ.png","2017-12-22 16:23:58","Hinweise bitte an die nächstgelegene Polizeidienststelle...","30","22"
"98-210-t3_7l8zrz","https://www.neues-deutschland.de/artikel/1074075.armut-in-deutschland-immer-mehr-rentner-stehen-bei-der-tafel-fuer-essen-an.html","2017-12-21 11:54:34","Altersarmut: 350.000 Rentner auf Tafeln angewiesen.","30","26"
"98-251-t3_7l8b3y","https://i.redd.it/ditd2h6aq8501.jpg","2017-12-21 09:01:37","hmmmm.jpg","29","27"
"98-201-t3_7l99o5","https://i.redd.it/j6s56ekmv9501.jpg","2017-12-21 12:52:37","[Trick 17] Die Enden eines Pflasters einschneiden, damit es besser an der Fingerkuppe hält.","29","18"
"98-216-t3_7l8uhp","http://www.ndr.de/nachrichten/Ko-Tropfen-Ein-Vergewaltigungsopfer-erzaehlt,kotropfen142.html","2017-12-21 11:19:29","K.o.-Tropfen: Ein Vergewaltigungsopfer erzählt","28","25"
"98-61-t3_7lhmgg","https://imgur.com/a/lwIgk","2017-12-22 14:06:50","Weitere LAN-Party Plakate","28","17"
"98-209-t3_7l91ou","https://i.redd.it/drdpvwbin9501.png","2017-12-21 12:06:39","Tja, selber Schuld.","28","16"
"98-166-t3_7lamb3","https://www.reddit.com/r/de/comments/7lamb3/schnelle_frage_an_die_berlin_brudis/","2017-12-21 16:43:03","Schnelle Frage an die Berlin brudis","26","26"
"98-82-t3_7lgs3w","https://www.reddit.com/r/de/comments/7lgs3w/aus_meiner_fb_timeline_sektenartiges_network/","2017-12-22 11:01:30","Aus meiner FB Timeline: Sektenartiges ""Network Marketing"". Pyramidenschema zum Selbstbauen. Was tun?","26","22"
"98-267-t3_7l7z7q","https://www.reddit.com/r/de/comments/7l7z7q/bewerbung_verlangt_arbeitszeugnis_habe_aber_keines/","2017-12-21 07:37:16","Bewerbung verlangt Arbeitszeugnis - habe aber keines?","26","25"
"98-239-t3_7l8jpr","https://www.apotheke-adhoc.de/nachrichten/detail/pharmazie/cannabis-aerzte-kennen-sich-zu-wenig-aus-spektrum-cannabis-medizinalhanf/","2017-12-21 10:05:06","Cannabis: Ärzte kennen sich zu wenig aus - Drei Viertel der Deutschen finden die Gesetzesänderung zu Medizinalhanf gut. Jeder Fünfte würde gerne medizinisches Cannabis verschrieben bekommen, bemängelt allerdings das unzureichende Wissen der Ärzte.","25","21"
"98-69-t3_7lha9t","https://www.reddit.com/r/de/comments/7lha9t/gesucht_karten_brettspiele_für_2_personen/","2017-12-22 12:59:51","[Gesucht] Karten- & Brettspiele für 2 Personen","25","24"
"98-231-t3_7l8mpw","http://www.migazin.de/2017/12/20/gehen-sie-ihre-heimat-ablehnungsschreiben/","2017-12-21 10:26:03","„Gehen Sie zurück in Ihre Heimat!“: Ablehnungsschreiben an syrischen Azubi-Bewerber macht sprachlos","25","21"
"98-29-t3_7lit1p","https://www.reddit.com/r/de/comments/7lit1p/schimmel_an_wand_nach_außen_wessen_schuld/","2017-12-22 17:20:16","Schimmel an Wand nach außen; wessen Schuld?","24","23"
"98-208-t3_7l91y2","https://i.redd.it/bhatm0nsn9501.jpg","2017-12-21 12:08:05","Danke Karen! Muss man wissen","24","22"
"98-96-t3_7lggeo","https://imgur.com/w2NLGhE","2017-12-22 09:38:25","Der innere Strunk meiner Mandarine sieht aus wie eine Backteriophage","24","22"
"98-66-t3_7lhgck","http://www.faz.net/-gqe-953u9","2017-12-22 13:34:39","Bitcoin-Hype: Eisteehersteller heißt neu „Long Blockchain“, steigert Wert um 200 Prozent","24","22"
"98-111-t3_7lfnwq","https://www.reddit.com/r/de/comments/7lfnwq/obligatorischer_was_schenckt_ihr_euren_eltern_zu/","2017-12-22 06:24:02","Obligatorischer ""Was schenckt ihr euren Eltern zu Weihnachten"" - Faden","23","23"
"98-26-t3_7liy0m","https://www.reddit.com/r/de/comments/7liy0m/welche_ansprüche_habe_ich_eigentlich_wenn_amazon/","2017-12-22 17:41:00","Welche Ansprüche habe ich eigentlich wenn Amazon sein ""garantiertes"" Lieferdatum nicht einhält?","23","20"
"98-136-t3_7lcug6","https://www.reddit.com/r/de/comments/7lcug6/erreichen_wir_bald_die_stau_singularität/","2017-12-21 22:04:41","Erreichen wir bald die Stau Singularität","23","17"
"98-74-t3_7lh2s6","https://www.youtube.com/watch?v=0sTQNbFHQSs","2017-12-22 12:14:05","00 Schneider - Nihil Baxter beim Arzt. Ein Klassiker des deutschen Kinos.","23","20"
"98-79-t3_7lgxm2","https://hpd.de/artikel/amazon-uk-nimmt-trainings-set-fuer-beschneidungen-dem-programm-15111","2017-12-22 11:40:17","Amazon UK nimmt Trainings-Set für Beschneidungen aus dem Programm","22","21"
"98-197-t3_7l9eao","https://www.reddit.com/r/de/comments/7l9eao/gute_podcasts_die_ihr_empfehlen_könnt/","2017-12-21 13:18:20","Gute Podcasts die ihr empfehlen könnt","22","21"
"98-153-t3_7lbmfm","https://imgur.com/dj8UWRy","2017-12-21 19:06:51","Tja.","22","18"
"98-114-t3_7lfh53","http://www.tagesschau.de/ausland/katalonien-regionalwahl-109.html","2017-12-22 05:44:39","Katalonien - Separatisten verteidigen absolute Mehrheit","22","17"
"98-98-t3_7lge25","https://i.imgur.com/DYeO5UP.jpg","2017-12-22 09:22:47","Sensation: r/de Mod beim Training erwischt.","22","18"
"98-128-t3_7ldeug","https://www.focus.de/politik/deutschland/transitlager-in-deutschland-deggendorf-fluechtlinge-protestieren-gegen-unterkunft-und-essen-regierung-weist-kritik-zurueck_id_8058068.html","2017-12-21 23:32:33","Flüchtlinge protestieren mit Hungerstreik - doch ihre Aktion wirft Fragen auf","22","17"
"98-76-t3_7lh0fm","http://www.otz.de/startseite/detail/-/specific/Maenner-Macht-und-Missbrauch-Vergewaltigungsvorwuerfe-in-der-AfD-495789043","2017-12-22 11:59:28","Männer, Macht und Missbrauch: Vergewaltigungsvorwürfe in der AfD","22","21"
"98-252-t3_7l8afo","https://www.mz-web.de/dessau-rosslau/arbeitsgericht--rauchen-ohne-ausstempeln---stadt-kuendigt-mitarbeiter-nach-25-jahren-29328226","2017-12-21 08:56:52","Arbeitsgericht : Rauchen ohne Ausstempeln - Stadt kündigt Mitarbeiter nach 25 Jahren","21","16"
"98-16-t3_7ljrz2","https://www.reddit.com/r/de/comments/7ljrz2/schon_mal_zum_üben_welche_weihnachtslieder_sind/","2017-12-22 19:47:32","Schon mal zum Üben: Welche Weihnachtslieder sind das?","21","21"
"98-9-t3_7lkfuh","https://i.imgur.com/AvYH6Na.jpg","2017-12-22 21:33:45","Unterlases Weihnachtstreffen","20","14"
"98-36-t3_7liiqw","https://www.reddit.com/r/de/comments/7liiqw/warum_stört_es_eigentlich_manche_leute_dass_der/","2017-12-22 16:36:45","Warum stört es eigentlich manche Leute, dass der Bitcoin Kurs eingebrochen ist?","20","18"
"98-254-t3_7l899h","https://www.tagesanzeiger.ch/leben/gesellschaft/Weder-Fluegel-noch-Rotoren/story/19673077","2017-12-21 08:47:54","«Weder Flügel noch Rotoren» - Das Pentagon beschäftigte sich jahrelang heimlich mit UFOs. Jetzt spricht ein Kampfpilot erstmals über seine skurrile Begegnung mit einem ihm unbekannten Flugobjekt.","19","19"
"98-27-t3_7live1","http://www.br.de/nachrichten/feuerwehr-ausgebremst-polizisten-angefahren-und-ehefrau-verpruegelt100.html","2017-12-22 17:30:16","A8 bei Hofolding: Feuerwehr ausgebremst, Polizist angefahren und Ehefrau verprügelt | Nachrichten | BR.de","19","19"
"98-161-t3_7lb1tl","https://youtu.be/Ub--Czta5Tw?t=1m","2017-12-21 17:44:55","Ankommende LKW beim GLS Logistikzentrum Bad Hersfeld legen Landstraße lahm...","18","16"
"98-195-t3_7l9j0v","http://i.imgur.com/A2h7ozR.jpg","2017-12-21 13:43:53","Ich esse jetzt Dönerpizza... Gottes Licht und so","18","15"
"98-168-t3_7lak2l","https://i.imgur.com/FuTBZyF.png","2017-12-21 16:33:56","Humor wär, wenn man trotzdem lacht. - Umgekehrt wär es aber vermutlich sofort eine Anzeige geworden...","18","15"
"98-94-t3_7lghbo","http://www.20min.ch/schweiz/bern/story/Mann-aus-Subingen-behaelt-den-Humor---auch-nach-dem-Ableben-10431075","2017-12-22 09:45:09","Die wohl witzigste Todesanzeige der Schweiz: Ein Subinger zeigt auch nach dem Tod Humor. In der Todesanzeige vermeldet er seine Adressänderung.","18","16"
"98-175-t3_7lac0q","http://www.prinzessinnenreporter.de/und-das-steht-wirklich-im-neuen-schwedischen-vergewaltigungs-gesetz/","2017-12-21 16:00:22","Und das steht wirklich im neuen schwedischen „Vergewaltigungs-Gesetz“","18","14"
"98-40-t3_7lih6r","https://www.n-tv.de/politik/Bannon-denkt-ueber-Praesidentschaft-nach-article20199552.html","2017-12-22 16:29:57","Trumps ehemaliger Chefideologe: Bannon denkt über Präsidentschaft nach","17","14"
"98-55-t3_7lhtro","https://www.reddit.com/r/de/comments/7lhtro/weihnachten_wer_von_euch_verschenkt_noch/","2017-12-22 14:43:56","Weihnachten: Wer von Euch verschenkt noch?","17","16"
"98-262-t3_7l83wa","https://www.htwk-leipzig.de/studieren/im-studium/studium-generale/fragen-und-antworten/","2017-12-21 08:09:05","Diese FAQs sind köstlich :D","17","17"
"98-230-t3_7l8nae","https://www.reddit.com/r/de/comments/7l8nae/how_much_do_german_tax_authority_employees_get/","2017-12-21 10:30:01","How much do German Tax Authority employees get paid","17","17"
"98-242-t3_7l8idz","https://www.reddit.com/r/de/comments/7l8idz/eine_frohe_wintersonnenwende_euch_allen/","2017-12-21 09:55:13","Eine frohe Wintersonnenwende euch allen!","16","16"
"98-104-t3_7lg4n0","http://www.sueddeutsche.de/stil/stilkritik-alle-in-die-warnwesten-1.3794120","2017-12-22 08:14:40","Alle in die Warnwesten!","16","13"
"98-271-t3_7l7w6e","http://taz.de/Zeugenaussagen-bei-G20-Prozessen/!5468423/","2017-12-21 07:17:55","Zeugenaussagen bei G20-Prozessen: „Besonderer Service“ für die Polizei","15","15"
"98-95-t3_7lgh89","https://i.redd.it/mhk6ti9p2g501.jpg","2017-12-22 09:44:21","Und im sechsten Monat wurde Sigmar Gabriel von Gott gesandt in eine Stadt in Galiläa, die heißt Nazareth, zu einer Jungfrau, die vertraut war einem Mann mit Namen Josef vom Hause David; und die Jungfrau hieß Maria.","15","14"
"98-90-t3_7lgkok","https://i.redd.it/tsv0hqw87g501.png","2017-12-22 10:08:46","Die Universität Heidelberg - ein Abenteuer!","15","13"
"98-206-t3_7l9315","https://www.reddit.com/r/de/comments/7l9315/quizduell/","2017-12-21 12:13:58","Quizduell","15","15"
"98-100-t3_7lga27","http://www.zeit.de/politik/ausland/2017-12/carles-puigdemont-neuwahl-katalonien-gewinner-dialog","2017-12-22 08:55:28","Kommentar: Rajoys harte Katalonien-Politik ist gescheitert","15","14"
"98-199-t3_7l9bwz","http://sz.de/1.3799657","2017-12-21 13:05:40","Rassistische Flugblätter an KZ-Gedenkstätte Dachau verteilt","15","13"
"98-115-t3_7lfgvw","http://www.deutschlandfunk.de/schuetzenvereine-im-wandel-koenigin-und-koenigin.862.de.html?dram:article_id=406661","2017-12-22 05:43:16","Königin und Königin - Schützenvereine im Wandel","15","12"
"98-101-t3_7lg6f3","http://m.spiegel.de/politik/ausland/syrien-russlands-feldzug-gegen-die-wahrheit-a-1184533.html","2017-12-22 08:27:35","Desinformation als Kriegswaffe: Russlands perfider Feldzug gegen die Wahrheit","15","14"
"98-255-t3_7l890c","http://www.taz.de/Nach-einer-Rede-im-Bundestag/!5469561/","2017-12-21 08:46:04","Nach einer Rede im Bundestag: Hexenjagd auf Schüler in Russland","14","14"
"98-148-t3_7lbz2y","http://www.sueddeutsche.de/politik/oeffentlichkeitsfahndung-die-methode-barbie-1.3801309","2017-12-21 19:57:52","Nach G-20-Gipfel: Methode Barbie - Politik(SZ Kommentar)","14","7"
"98-46-t3_7libm4","https://i.redd.it/wzoi2lpryh501.jpg","2017-12-22 16:06:05","Candy & Hermes","14","8"
