"id","url","stime","title","nocommentsgesamt","nocommentsx"
"98-8-t3_7lkg8z","https://www.reddit.com/r/de/comments/7lkg8z/kleines_weihnachtswunder/","2017-12-22 21:35:46","Kleines Weihnachtswunder","13","9"
"98-130-t3_7ld74y","https://i.redd.it/m87qm3rwvc501.jpg","2017-12-21 22:58:49","Zu salzig","13","9"
"98-145-t3_7lc4wp","https://www.reddit.com/r/de/comments/7lc4wp/gastbeitrag_zur_kryptowährung_bitcoin/","2017-12-21 20:21:01","Gastbeitrag zur Kryptowährung Bitcoin - Einschätzung von Leuten mit mehr Plan vom Thema gesucht","13","12"
"98-110-t3_7lfpbq","http://www.spiegel.de/politik/ausland/grossbritannien-boris-johnson-wirft-russland-destabilisierung-europas-vor-a-1184612.html#ref=rss","2017-12-22 06:33:28","Britischer Außenminister: Johnson wirft Russland Destabilisierung Europas vor","13","13"
"98-217-t3_7l8tlm","https://www.amazon.de/dp/B06ZYTKH9Q/","2017-12-21 11:13:25","Für ein Last-Minute-Geschenk reicht es zwar nicht mehr, aber eine tolle Überraschung ist es trotzdem [Link zu Amazon]","13","13"
"98-257-t3_7l86e4","http://www.spiegel.de/lebenundlernen/schule/lueneburg-weihnachtsfeier-laut-schule-nicht-wegen-muslimin-verschoben-a-1184273.html","2017-12-21 08:26:23","Schule in Lüneburg: Aufregung um eine verschobene Weihnachtsfeier","13","13"
"98-162-t3_7lazrn","https://www.mopo.de/hamburg/polizei/er-hortete-waffen-polizist-wegen-nazi-vorwurf-versetzt-23428234","2017-12-21 17:36:33","Er hortete Waffen: Polizist wegen Nazi-Vorwurf versetzt","13","9"
"98-238-t3_7l8jzc","https://www.reddit.com/r/de/comments/7l8jzc/an_wen_sollte_man_am_besten_spenden/","2017-12-21 10:07:01","An wen sollte man am besten spenden?","13","12"
"98-127-t3_7ldm76","https://i.redd.it/ou8k67c68d501.jpg","2017-12-22 00:07:33","Möchte Focus überhaupt, dass man seine Artikel liest?","13","10"
"98-165-t3_7laq9y","http://www.spiegel.de/politik/ausland/donald-trump-seine-drohung-vor-der-uno-resolution-zu-jerusalem-ist-ein-eigentor-a-1184497.html","2017-12-21 16:58:50","Uno-Resolution zu Jerusalem: Trumps diplomatisches Eigentor - Wer in der Jerusalem-Frage nicht seiner Meinung ist, dem will Donald Trump das Geld streichen: Das hat er vor einer Abstimmung der Uno-Vollversammlung angekündigt. Gut so - die Welt wird sehen, wie isoliert die USA sind.","13","11"
"98-269-t3_7l7xow","https://i.redd.it/s7pt54fe98501.png","2017-12-21 07:27:18","Ich hätte auch das Bild gewählt, um zu illustrieren wie man Würde bewahrt","13","12"
"98-191-t3_7l9lnv","https://imgur.com/9vOFJ4D","2017-12-21 13:57:44","He he.","12","12"
"98-225-t3_7l8q5f","https://i.redd.it/vukvtbkv99501.jpg","2017-12-21 10:50:29","Das neue Österreichische Fernsehprogramm wurde vom Falter geleakt.","12","6"
"98-261-t3_7l84mk","http://orf.at/stories/2419713/","2017-12-21 08:14:02","Schüsse an Grenze: Erneut Soldat aus Nordkorea geflohen","11","11"
"98-169-t3_7lah1u","https://i.redd.it/pb46xqq9t8501.jpg","2017-12-21 16:20:58","This belong here?","11","11"
"98-50-t3_7li46f","https://i.redd.it/nbaplv63th501.jpg","2017-12-22 15:32:10","Wenn man sich anstrengt, kann man‘s ihm nach dem vierten Blick ansehen","11","6"
"98-67-t3_7lhbl6","http://www.tagesschau.de/inland/schuldenuhr-101.html","2017-12-22 13:07:22","Öffentliche Haushalte: Schuldenuhr läuft erstmals rückwärts","11","9"
"98-198-t3_7l9ctt","https://www.reddit.com/r/de/comments/7l9ctt/fragediskussionfunktionieren_led_birnen_in_jeder/","2017-12-21 13:10:30","[Frage/Diskussion]Funktionieren LED Birnen in jeder Lampe?","11","11"
"98-272-t3_7l7uhy","https://derstandard.at/2000070759504/Israel-plant-angeblich-massiven-Siedlungsausbau-im-Westjordanland","2017-12-21 07:07:38","Israel soll massiven Siedlungsbau im Westjordanland planen","11","7"
"98-102-t3_7lg61u","https://www.golem.de/news/keeper-security-passwortmanager-hersteller-verklagt-journalist-dan-goodin-1712-131805.html","2017-12-22 08:24:39","Keeper Security: Passwortmanager-Hersteller verklagt Journalist Dan Goodin","11","11"
"98-31-t3_7lin4n","https://i.redd.it/6c3xb30w7i501.jpg","2017-12-22 16:55:29","Ist die Wissenschaft zu weit gegangen?","11","8"
"98-244-t3_7l8fne","https://youtu.be/f6m9tvs3PhU","2017-12-21 09:35:09","Deutsche vs Britische Weihnachtsmärkte","10","8"
"98-62-t3_7lhkby","https://www.reddit.com/r/de/comments/7lhkby/lpt_kleine_einkäufe_vor_den_feiertagen/","2017-12-22 13:56:06","LPT: Kleine Einkäufe vor den Feiertagen","10","7"
"98-132-t3_7ld70j","https://www.reddit.com/r/de/comments/7ld70j/hilfe_schwiegermama_in_spe_zu_besuch/","2017-12-21 22:58:14","Hilfe! Schwiegermama in spe zu Besuch!","10","10"
"98-85-t3_7lgoio","http://www.zeit.de/digital/internet/2017-12/leistungsschutzrecht-presseverleger-eu-kommission-haelt-studie-zurueck","2017-12-22 10:35:46","Leistungsschutzrecht: EU-Kommission hält kritische Studie zurück","10","8"
"98-124-t3_7ldrpy","https://www.reddit.com/r/de/comments/7ldrpy/weihnachtsmann_sein_oder_nicht_sein/","2017-12-22 00:32:05","[Weihnachtsmann] sein oder nicht sein?","10","10"
"98-249-t3_7l8c4y","https://www.facebook.com/panorama.de/videos/1172141639590171/","2017-12-21 09:09:09","Früher war alles besser. Oder? (Facebook Warnung)","10","10"
"98-38-t3_7lihud","https://i.imgur.com/TZPUBzs.jpg","2017-12-22 16:32:42","Weihnachten am Kölner Doom","10","8"
"98-28-t3_7litu6","https://www.focus.de/politik/deutschland/anschlag-auf-berliner-weihnachtsmarkt-im-visier-des-verfassungsschutzes-radikal-imam-sprach-bei-gedenkfeier-fuer-terror-opfer_id_8069389.html","2017-12-22 17:23:30","Berlin: Radikal-Imam sprach bei Gedenkfeier für Terror-Opfer - Deutschland","9","6"
"98-173-t3_7lae16","https://www.gruenderszene.de/allgemein/so-verteuern-bots-unseren-weihnachtseinkauf?utm_source=gruenderszene&utm_medium=rotationbox&utm_term=0&utm_content=post&utm_campaign=/allgemein/so-verteuern-bots-unseren-weihnachtseinkauf&ref=rotationbox","2017-12-21 16:08:45","So verteuern Bots unseren Weihnachtseinkauf","9","9"
"98-250-t3_7l8bfu","https://www.reddit.com/r/de/comments/7l8bfu/5_jahrestag_des_weltunterganges_ein_resümee/","2017-12-21 09:04:15","5 Jahrestag des Weltunterganges: Ein Resümee","9","9"
"98-266-t3_7l80sp","http://www.zeit.de/kultur/2017-12/steuerreform-usa-donald-trump-steuereinnahmen-neoliberalismus-wohlfahrtsstaat-usa","2017-12-21 07:48:08","Trumps Angriff auf Amerika - Wie die Steuerreform der Republikaner bereits in den 70er Jahren vorbereitet wurde","9","7"
"98-281-t3_7l5bb5","https://www.reddit.com/r/de/comments/7l5bb5/probleme_mit_dem_mietvertrag/","2017-12-20 23:20:50","Probleme mit dem Mietvertrag","9","9"
"98-105-t3_7lfzzm","https://heinz-grill.de/vollautomatisiertes-auto-produkt-kirche/","2017-12-22 07:42:40","Selbstfahrende Autos sind nicht spirituell und dahinter steckt die Kirche. Mussmanwissen.","9","9"
"98-7-t3_7lkk55","http://www.tagesschau.de/ausland/urteil-familiennachzug-101.html","2017-12-22 21:53:41","Verwaltungsgericht: Beim Familiennachzug zählt das Kindeswohl","8","7"
"98-30-t3_7lirit","https://www.youtube.com/watch?v=odVr5S_hLrk","2017-12-22 17:13:35","Mit Drohnen auf Wildschweine: Bayerns Jäger rüsten auf | quer mit Christoph Süß - BR | youtube.com (x-post /r/Jagd)","8","8"
"98-214-t3_7l8vrz","https://www.reddit.com/r/de/comments/7l8vrz/letzte_minute_geschenkeliste_schnelle_frage/","2017-12-21 11:28:39","Letzte Minute Geschenkeliste schnelle Frage Antwort Runde","8","8"
"98-65-t3_7lhgzv","https://imgur.com/5RCLr1f","2017-12-22 13:38:18","Ich glaube die Gorch Fock hat etwas an Wert verloren.","8","3"
"98-83-t3_7lgqx4","https://www.lto.de/recht/hintergruende/h/twitter-pranger-antisemitismus-persoenlichkeitsrecht-sozialsphaere-gegen-judenhass/","2017-12-22 10:52:58","Twitter-Pranger gegen Antisemitismus erlaubt?","8","8"
"98-183-t3_7la0cn","https://imgur.com/a/8yPD7","2017-12-21 15:08:57","HLI, dass es eine islamistische Bewegung mit dem Namen ""MILF"" gibt","8","7"
"98-154-t3_7lbhay","http://www.sueddeutsche.de/politik/jerusalem-konflikt-un-vollversammlung-usa-sollen-jerusalem-entscheidung-zuruecknehmen-1.3802509","2017-12-21 18:46:45","UN-Vollversammlung: USA sollen Jerusalem-Entscheidung zurücknehmen","8","5"
"98-12-t3_7lkck8","http://www.zeit.de/politik/ausland/2017-12/unesco-israel-vereinte-nationen-austritt","2017-12-22 21:18:36","Vereinte Nationen: Israel verkündet Unesco-Austritt bis Ende 2018 | zeit.de","7","6"
"98-219-t3_7l8stp","https://www.heise.de/newsticker/meldung/Mit-Holz-hoch-hinaus-das-hoechste-Holz-Hochhaus-3918560.html","2017-12-21 11:08:38","2018 eröffnet das weltweit höchste Hochhaus aus Holz - 24 Stockwerke. Das klingt kuschelig, aber auch feuergefährlich. Kann man trotzdem unbesorgt einziehen?","7","6"
"98-282-t3_7l5980","https://i.redd.it/g23q4376t5501.jpg","2017-12-20 23:12:02","""Der instrumentalisierte Antisemitismus"" FAZ Kommentar/Analyse","7","7"
"98-270-t3_7l7wq9","https://i.imgur.com/2om9cZu.jpg","2017-12-21 07:21:18","Das ""D"" und DB steht für DIY","6","3"
"98-193-t3_7l9l4c","https://www.youtube.com/watch?v=8tztlrIzlyU","2017-12-21 13:54:53","Die neue Seilbahn Zugspitze erschließt ab sofort den höchsten Berg des Landes und wartet dabei mit gleich drei spektakulären Weltrekorden auf","6","5"
"98-63-t3_7lhj8k","http://meedia.de/2017/12/21/bueros-der-cdu-sind-viel-groesser-ein-skandal-titanic-foppt-afd-abgeordnete-mit-falschen-bundestags-hausmeistern/","2017-12-22 13:50:18","„Büros der CDU sind viel größer – ein Skandal“: Titanic foppt AfD-Abgeordnete mit falschen Bundestags-„Hausmeistern“","6","3"
"98-77-t3_7lgzyw","https://www.arte.tv/de/videos/071436-003-A/re-polen-vor-der-zerreissprobe/","2017-12-22 11:56:28","Re: Polen vor der Zerreißprobe | ARTE","6","6"
"98-33-t3_7limv4","https://imgur.com/gallery/SAJEJ","2017-12-22 16:54:30","Der Spinnenbrudi rettet Weihnachten","6","4"
"98-158-t3_7lb69m","https://www.reddit.com/r/de/comments/7lb69m/gibt_es_eine_website_um_die_weltcup_zu_ansehen_dh/","2017-12-21 18:02:53","Gibt es eine Website, um die Weltcup zu ansehen (d.h. zu streamen)?","6","6"
"98-277-t3_7l6n0j","https://www.bz-berlin.de/berlin/tempelhof-schoeneberg/sechs-minuten-unertraeglicher-hass-gegen-juden-mitten-in-berlin","2017-12-21 03:06:44","Sechs Minuten unerträglicher Hass gegen Juden – mitten in Berlin","6","5"
"98-236-t3_7l8kv8","http://www.globalorgasm.org/","2017-12-21 10:12:56","Heute ist Welt-Orgasmus-Tag","6","6"
"98-142-t3_7lcbf2","http://www.sueddeutsche.de/bayern/weihnachten-pendler-feiern-weihnachtsfeier-in-der-s-bahn-1.3802420","2017-12-21 20:47:37","Morgens halb 8 in der S-Bahn...","6","6"
"98-229-t3_7l8nkl","https://i.imgur.com/Rd5yLxS.jpg","2017-12-21 10:31:58","Ich glaube ich habe die Legastheniker-Version von PUBG erwischt","6","6"
"98-212-t3_7l8wl2","http://www.ardmediathek.de/tv/Zapp/Abgebrochen-metoo-Debatte-bei-Shabab-/NDR-Fernsehen/Video?bcastId=3714742&documentId=47960938","2017-12-21 11:34:12","Sehenswert: Abgebrochen: #metoo-Debatte bei Deutsche Welle Sendung ""Shabab Talk"" (04:44min) - Ein jordanischer Politiker verließ die Sendung ""Shabab Talk"", als eine Frau im Rahmen der #metoo-Debatte über sexuelle Belästigung in Jordanien sprach.","6","5"
"98-172-t3_7laejz","https://www.welt.de/wirtschaft/article171801021/Deutsche-Post-Winterprobleme-mit-dem-Streetscooter.html","2017-12-21 16:10:49","Post-Zusteller haben Angst, den Streetscooter zu nutzen","6","6"
"98-113-t3_7lfkfx","http://ondemand-mp3.dradio.de/file/dradio/2017/12/21/anmerkungen_zur_facebook_sprache_des_tuebinger_dlf_20171221_1741_de26cb08.mp3","2017-12-22 06:03:42","[podcast] Facebook als ""dark room""? Boris Palmer und die Verwahrlosung der Sprache (3 min)","5","5"
"98-34-t3_7likgq","https://imgur.com/gallery/gTCz3","2017-12-22 16:44:08","I raise your LAN-Party Poster by a LAN-Party T-Shirt","5","4"
"98-213-t3_7l8vum","http://augengeradeaus.net/2017/12/lkw-kartellabsprachen-bis-zu-10-000-bundeswehr-laster-betroffen/","2017-12-21 11:29:14","LKW-Kartellabsprachen: Bis zu 10.000 Bundeswehr-Laster betroffen","5","5"
"98-18-t3_7ljltb","http://www.deliberationdaily.de/2017/12/toxische-femininitaet-eine-begriffsklaerung/","2017-12-22 19:20:38","Toxische Femininität – Eine Begriffsklärung","5","4"
"98-80-t3_7lgult","http://www.fnp.de/lokales/frankfurt/ABG-Holding-zieht-Klage-gegen-Mieter-zurueck;art675,2861107","2017-12-22 11:18:07","Kapitulation: ABG Holding zieht Klage gegen Mieter zurück - Ein Mieter muss nicht, wie alle anderen, die Montage von Funkmessern an Heizung und Wasseranschluss dulden. Das Amtsgericht sah Datenschutzfragen offen.","5","3"
"98-274-t3_7l7qye","http://www.spiegel.de/politik/ausland/wahlkrimi-in-virginia-gericht-hebt-ein-stimmen-vorsprung-wieder-auf-a-1184426.html","2017-12-21 06:45:44","Entscheidung durch Münzwurf | Wahlkrimi in Virginia: Gericht hebt Ein-Stimmen-Vorsprung wieder auf - SPIEGEL ONLINE","5","5"
"98-4-t3_7lkppk","https://www.youtube.com/watch?v=tsdqPHILbRU","2017-12-22 22:19:45","Wie sich Mozart auf einem Katzenklavier anhört","5","5"
"98-121-t3_7ldwpb","http://www.zeit.de/wirtschaft/unternehmen/2017-12/insolvenz-paracelsus-kliniken-osnabrueck","2017-12-22 00:56:58","Paracelsus-Kliniken: Klinikkette meldet Insolvenz an","5","5"
"98-227-t3_7l8pah","https://imgur.com/O7YH0jX","2017-12-21 10:44:20","Weiß hier jemand was los war?","4","4"
"98-181-t3_7la5bf","https://www.wsj.com/articles/twelve-days-in-xinjiang-how-chinas-surveillance-state-overwhelms-daily-life-1513700355","2017-12-21 15:31:25","[ENG] Twelve Days in Xinjiang: How China’s Surveillance State Overwhelms Daily Life | Bericht über Chinas Modell Überwachungsstaat","4","4"
"98-253-t3_7l89gk","http://www.taz.de/Maedchenrechte-im-Irak/!5469623/","2017-12-21 08:49:25","Mädchenrechte im Irak: Ein großer Erfolg für die Frauen","4","3"
"98-49-t3_7li4c6","https://i.redd.it/6vnvffj7th501.jpg","2017-12-22 15:32:49","Oberarm enlargement Pillen","4","4"
"98-164-t3_7lasb7","https://i.redd.it/99yfmah35b501.jpg","2017-12-21 17:06:43","Honor Deutschland verärgert","4","2"
"98-129-t3_7ld83i","https://netzpolitik.org/2017/twitter-sperrt-account-des-aegyptischen-menschenrechtlers-wael-abbas/","2017-12-21 23:02:58","Twitter sperrt Account des ägyptischen Menschenrechtlers Wael Abbas","4","3"
"98-24-t3_7lj3fa","http://www.spiegel.de/panorama/bundespolizei-mauschelei-bei-millionenauftrag-fuer-bodycams-a-1184675.html","2017-12-22 18:02:56","Innenministerium mauschelte bei Millionenauftrag für Bodycams","4","4"
"98-14-t3_7lk6lz","https://i.redd.it/765618d2ej501.jpg","2017-12-22 20:51:41","Hmm","4","4"
"98-75-t3_7lh2ep","https://i.redd.it/hlyxdfcbtg501.jpg","2017-12-22 12:11:45","Ein echter Mettmann","4","3"
"98-131-t3_7ld70v","https://i.redd.it/hkhnijwsvc501.jpg","2017-12-21 22:58:16","Seit wann gehört denn das Elsass wieder zu Deutschland?","4","2"
"98-13-t3_7lk91f","https://www.reddit.com/r/de/comments/7lk91f/duschgedanke_warum_habe_ich_eigentlich_noch_keine/","2017-12-22 21:02:39","[Duschgedanke] Warum habe ich eigentlich noch keine Witze über den Namen des ehemaligen katalonischen Separatisten-Führers gehört?","4","4"
"98-72-t3_7lh7nc","https://www.reddit.com/r/de/comments/7lh7nc/duschgedanke_warum_heißt_es_handschuhe_und_nicht/","2017-12-22 12:44:05","[Duschgedanke] Warum heißt es Handschuhe und nicht Handsocken?","4","3"
"98-157-t3_7lb8js","https://bar.wikipedia.org/wiki/Boarisch","2017-12-21 18:11:18","HLI, dass es WikiPedia auch auf Bairisch gibt","4","4"
"98-233-t3_7l8lti","http://www.spiegel.de/spiegel/an-den-schienen-der-pfinztalbahn-legt-ein-unbekannter-hackfleisch-ab-a-1184148.html","2017-12-21 10:19:33","Mysteriöser Serientäter: Der Hackepeter von Pfinztal. Über Wochen hinweg deponierte ein Unbekannter einen Klumpen Fleisch an den Schienen der Pfinztalbahn. Was wissen die Anwohner?","4","4"
"98-68-t3_7lhan5","https://imgur.com/XD8SdVi","2017-12-22 13:01:50","Der absolute Mettmann","4","4"
"98-141-t3_7lccmr","https://www.reddit.com/r/de/comments/7lccmr/ndw_webseite/","2017-12-21 20:52:31","NDW Webseite?","4","4"
"98-263-t3_7l82v5","http://imgur.com/G1D5F4s","2017-12-21 08:02:08","VERKAUFT ALLE BITCOIN MAIMAIS","4","3"
"98-245-t3_7l8fjz","http://www.faz.net/aktuell/wirtschaft/wirtschaft-in-zahlen/stetiges-anziehen-der-stellschraube-zur-mehrwertsteuer-15349723.html","2017-12-21 09:34:20","Von zehn auf 19 Prozent","4","4"
"98-123-t3_7ldt21","https://www.youtube.com/watch?v=ZzwCpRdhsXk","2017-12-22 00:38:31","Wie viel Zappelstrom verträgt das Netz? Bemerkungen zur deutschen Energiewende von Hans-Werner Sinn","4","3"
"98-11-t3_7lkeu5","https://www.youtube.com/watch?v=aDax1POgMhI","2017-12-22 21:29:10","Auf einen Gulag mit Moritz Neumeier","4","3"
"98-171-t3_7laemd","https://www.youtube.com/watch?v=9L0IiijfzqU","2017-12-21 16:11:08","G20-Chaos - Wer hat Schuld? | 45 Min | NDR","3","1"
"98-279-t3_7l5p43","https://www.reddit.com/r/de/comments/7l5p43/wie_kommen_die_vitamine_in_die_multivitaminbonbons/","2017-12-21 00:21:02","Wie kommen die Vitamine in die Multivitaminbonbons?","3","3"
"98-196-t3_7l9g2x","http://www.aero.de/news-28123/Eurowings-bekommt-fuer-Duesseldorf-eine-echte-Business-Class.html","2017-12-21 13:28:25","Eurowings bekommt (für Düsseldorf) eine echte Business Class: Die Eurowings ""BIZclass"" für Düsseldorf bricht mit einer Produktstrategie, mit der Lufthansa Eurowings vom eigenen Produkt deutlich abgrenzte.","3","3"
"98-119-t3_7levke","https://multinational.io/de/compare_passports/Deutschland","2017-12-22 03:49:12","Vergleichen Sie den Pass von Deutschland mit anderen Pässen","3","3"
"98-187-t3_7l9siu","https://i.redd.it/axk5mlzdda501.jpg","2017-12-21 14:31:43","Mein Zwischennetz funktioniert gerade auch nicht","3","3"
"98-224-t3_7l8qcd","http://www.zeit.de/zeit-magazin/leben/2017-12/spielzeug-sexismus-puppen-aussehen-rollenklischees","2017-12-21 10:51:44","Spielzeug: Vom Sandkasten in den Beautysalon","3","3"
"98-6-t3_7lkkn5","https://www.youtube.com/watch?v=1QFps8LkoI8","2017-12-22 21:55:57","Aus gegebenen Anlass: Djong Yun und Popol Vuh","3","3"
"98-273-t3_7l7uer","http://www.heute.at/welt/news/story/Auto-rast-in-Melbourne-in-Menschenmenge-44868552","2017-12-21 07:07:06","Mehrere Personen verletzt - Auto rast in Melbourne in Menschenmenge","3","3"
"98-106-t3_7lfzel","http://www.spiegel.de/wirtschaft/unternehmen/unilever-verkauft-rama-und-becel-fuer-milliarden-an-finanzinvestor-kkr-a-1183663.html","2017-12-22 07:38:48","Milliardendeal: Unilever verkauft Rama und Becel","3","3"
"98-256-t3_7l87ss","http://www.scinexx.de/wissen-aktuell-22237-2017-12-21.html","2017-12-21 08:36:55","Schimpansen wollen unsoziales Verhalten rügen","3","3"
"98-135-t3_7lcx51","http://www.spiegel.de/gesundheit/psychologie/mo-gawdat-glueck-ist-wenn-das-gehirn-die-klappe-haelt-a-1184095.html","2017-12-21 22:15:52","Formel für Zufriedenheit: ""Glück ist, wenn das Gehirn die Klappe hält"" - SPIEGEL ONLINE - Gesundheit","3","2"
"98-44-t3_7lieyw","http://www.zeit.de/wirtschaft/2017-12/einkommensungleichheit-studie-thomas-piketty-chancen-gleichheit?wt_zmc=sm.ext.zonaudev.twitter.ref.zeitde.share.link.x","2017-12-22 16:20:28","Einkommensungleichheit: Umverteilung allein hilft nicht","3","1"
"98-51-t3_7lhx98","https://www.heise.de/newsticker/meldung/Europaeisches-Leistungsschutzrecht-EU-Kommission-hielt-kritische-Studie-versteckt-3927277.html","2017-12-22 15:00:49","Europäisches Leistungsschutzrecht: EU-Kommission hielt kritische Studie versteckt","3","3"
"98-152-t3_7lbubb","http://www.tagesspiegel.de/berlin/antidiskriminierungsgesetz-rot-gruener-appell-gegen-das-kopftuch-an-berliner-schulen/20762838.html","2017-12-21 19:38:43","Rot-grüner Appell gegen das Kopftuch an Berliner Schulen","3","2"
"98-150-t3_7lby4z","https://imgur.com/lL3QOco","2017-12-21 19:54:06","/r/IchhabeeineFreundin","2","2"
"98-243-t3_7l8h4g","http://www.spiegel.de/panorama/justiz/deggendorf-das-seltsame-leben-des-pater-thomas-a-1183913.html","2017-12-21 09:46:04","Missbrauchsprozess gegen Ex-Priester: Das seltsame Leben des Pater Thomas - Als Pater Thomas gewann er das Vertrauen einer Kirchengemeinde. Nun steht er vor Gericht, unter anderem wegen Kindesmissbrauchs. Und Gläubige fragen sich, wie sehr man sich in einem Menschen täuschen kann.","2","2"
"98-146-t3_7lc2oi","http://www.tagesschau.de/wirtschaft/vw-kuendigung-101.html","2017-12-21 20:12:18","VW kündigt Ex-Manager Schmidt","2","2"
"98-126-t3_7ldmkl","http://www.deutschlandfunk.de/chanson-des-monats-dezember-iiiiih-ein-suv.807.de.html?dram:article_id=402681","2017-12-22 00:09:07","Chanson des Monats Dezember - Iiiiih, ein SUV!","2","2"
"98-19-t3_7ljjjo","http://www.zew.de/de/presse/pressearchiv/deutschland-ist-der-verlierer-der-us-steuerreform/?cHash=75addafc432190cf3c257046de2fb167","2017-12-22 19:10:31","Deutschland ist der Verlierer der US-Steuerreform ""Der Wettbewerb in der EU um US-Investitionen wird zunehmen""","2","2"
"98-22-t3_7lj92z","http://www.spiegel.de/politik/ausland/boris-johnson-soll-regierung-russlands-beleidigt-haben-a-1184667.html","2017-12-22 18:25:37","Britischer Außenminister in Moskau: Russische Regierung fühlt sich von Boris Johnson beleidigt","2","2"
"98-215-t3_7l8vim","https://www.computerbase.de/2017-12/magic-leap-erstes-ar-headset-lichtfeldtechnik/","2017-12-21 11:26:48","Magic Leap One: AR-Headset mit Lichtfeldtechnik kommt 2018 - Magic Leap zeigt sieben Jahre nach Gründung und fast zwei Milliarden US-Dollar gesammeltem Kapital sein erstes AR-Headset One, das Microsofts HoloLens ähnelt.","2","1"
"98-159-t3_7lb47e","https://imgur.com/Y6dqcuV","2017-12-21 17:54:27","Puppyseat :)","2","1"
"98-228-t3_7l8p1f","http://www.zeit.de/zeit-magazin/2017/53/seele-psychologie-existenz-suche","2017-12-21 10:42:34","Psychologie: Was ist die Seele?","2","2"
"98-143-t3_7lca0d","http://www.taz.de/!5468429/","2017-12-21 20:42:03","Miese Zuchtbedingungen in Thüringen: Ein Schweineleben","2","2"
"98-78-t3_7lgzl7","https://twitter.com/Dagobert95/status/944143091002433536/photo/1","2017-12-22 11:54:09","Wenn Sam Ficken den Verein wechselt","2","1"
"98-184-t3_7l9x9r","https://goo.gl/forms/CR7AKMOl77WimQ6N2","2017-12-21 14:54:41","Hobbyclub: Abstimmung über das erste Hobby 2017","2","2"
"98-188-t3_7l9rng","https://www.youtube.com/watch?v=N2fF3QOT6cQ","2017-12-21 14:27:23","Oh du Ehrliche - Weihnachten unzensiert","2","2"
"98-223-t3_7l8qga","http://www.zeit.de/gesellschaft/2017-12/schwangerschaftsabbruch-werbung-abtreibung-gesetzesaenderung/komplettansicht","2017-12-21 10:52:26","Schwangerschaftsabbruch: Von Abtreibung und Menschenrecht","2","2"
"98-15-t3_7lk5ug","http://www.spiegel.de/sport/fussball/dfb-beendet-freundschaftsspiele-mit-chinesischer-u20-a-1184767.html","2017-12-22 20:48:10","DFB beendet Testspielprojekt mit chinesischer U20","2","2"
"98-112-t3_7lfld2","https://imgur.com/34XcsrR","2017-12-22 06:08:46","Akku Problem? Diese App hilft!","2","1"
"98-32-t3_7lin26","https://www.youtube.com/watch?v=5FN8CEvvPl4","2017-12-22 16:55:15","Helge Schneider - Katzenoma","2","2"
"98-25-t3_7liyez","http://www.spiegel.de/politik/deutschland/andreas-nahles-kritisiert-zustand-der-spd-und-fordert-parlamentsreform-a-1184688.html","2017-12-22 17:42:31","Nahles warnt SPD vor Oppositionssehnsucht","2","2"
"98-185-t3_7l9v9x","http://www.deutschlandfunkkultur.de/verbrechen-an-den-hereros-und-den-namas-ringen-um-die.976.de.html?dram:article_id=406540","2017-12-21 14:45:17","Verbrechen an den Hereros und den Namas - Ringen um die Anerkennung der deutschen Schuld","1","1"
"98-265-t3_7l81cu","https://www.fian.de/artikelansicht/2017-12-20-aktualisiertes-factsheet-auf-dem-weg-zu-einer-erklaerung-fuer-die-rechte-von-kleinbaeuerinnen/","2017-12-21 07:52:05","Factsheet ""Auf dem Weg zu einer Erklärung für die Rechte von KleinbäuerInnen"" (Mit Link zum PDF)","1","1"
"98-246-t3_7l8eqp","https://posteo.de/blog/sicherheits-warnung-f%C3%BCr-thunderbird-und-enigmail-nutzer-schwachstellen-gef%C3%A4hrden-vertraulichkeit-der-kommunikation","2017-12-21 09:28:13","Sicherheits-Warnung für Thunderbird- und Enigmail-Nutzer: Schwachstellen gefährden Vertraulichkeit der Kommunikation","1","1"
"98-5-t3_7lkn6z","https://www.zdf.de/nachrichten/heute/deutliches-absatzplus-oelverbrauch-in-deutschland-steigt-100.html","2017-12-22 22:07:43","Ölverbrauch in Deutschland steigt","1","1"
"98-144-t3_7lc74l","http://www.spiegel.de/politik/ausland/katalonien-erste-tendenz-zur-regionalwahl-a-1184590.html","2017-12-21 20:30:10","Erste Tendenz nach Wahl: Katalanische Separatisten laut Umfrage vorne","1","1"
"98-174-t3_7ladm9","http://cdn1.spiegel.de/images/image-1230098-860_poster_16x9-optd-1230098.jpg","2017-12-21 16:07:05","oder so ...","1","1"
"98-120-t3_7ldx14","http://www.faz.net/aktuell/un-vollversammlung-amerika-soll-jerusalem-entscheidung-zuruecknehmen-15353951.html","2017-12-22 00:58:38","UN-Vollversammlung stimmt gegen Washington: Trumps Erpressungsversuch scheitert kläglich","1","1"
"98-47-t3_7liat9","https://www.saarbruecker-zeitung.de/politik/themen/man-darf-noch-lange-nicht-entwarnung-geben_aid-6975925","2017-12-22 16:02:27","Interview Reiner Holznagel, Bund der Steuerzahler: „Man darf noch lange nicht Entwarnung geben“","1","1"
"98-178-t3_7la62b","https://www.tagesschau.de/inland/tagesschau-rekordjahr-101.html","2017-12-21 15:34:50","ARD-Nachrichtensendungen: Rekordjahr für die tagesschau","1","1"
"98-37-t3_7liiar","https://m.heise.de/newsticker/meldung/Europaeisches-Leistungsschutzrecht-EU-Kommission-hielt-kritische-Studie-versteckt-3927277.html","2017-12-22 16:34:51","Europäisches Leistungsschutzrecht: EU-Kommission hielt kritische Studie versteckt","1","1"
"98-180-t3_7la5fu","http://www.spiegel.de/einestages/russische-revolution-a-948934.html","2017-12-21 15:31:57","Russische Revolution: Agent der Macht (über Heinrich Bockelmann, Großvater von Udo Jürgens)","1","1"
"98-147-t3_7lbzer","https://www.reddit.com/r/de/comments/7lbzer/21_uhr_ist_xfactor_zeit/","2017-12-21 19:59:06","21 Uhr ist XFactor zeit!","1","1"
"98-53-t3_7lhurb","https://www.youtube.com/watch?v=ysvVJR-Qh5Q","2017-12-22 14:48:37","WEIHNACHTEN - EIN FEST DER ZEIT - Impulse by Nik Pichler ep. 18","1","1"
